{"schema_version":"1.0","scenario_id":"ruru-352698-d2-panda-guard-allocation","log_id":"ruru-352698","cutoff_event_id":"ruru352698.provisional.d2.group-vote-order","perspective":{"kind":"public","actor_id":null,"notes":"2日目、3-1-2が成立し、参加できるよがパンダかつCOなし、共有がグレランを指示した後の公開盤面。"},"public_facts":[{"fact_id":"f1","statement":"16人生存、7吊り5人外である。","source_event_ids":["ruru352698.provisional.d2.shared-fo"],"confidence":"deterministic","alternatives":[]},{"fact_id":"f2","statement":"ずぶぬれお化けは参加できるよ●、ぴゅりくれあは参加できるよ○を主張している。","source_event_ids":["ruru352698.provisional.d2.zubunure-black-participate","ruru352698.provisional.d2.pyuri-white-participate"],"confidence":"reviewed_extraction","alternatives":[]},{"fact_id":"f3","statement":"バリアントナイフは17Aマン○を主張している。","source_event_ids":["ruru352698.provisional.d2.variant-white-17aman"],"confidence":"reviewed_extraction","alternatives":[]},{"fact_id":"f4","statement":"時間遡行が単独霊能COし、メンバーとちっすーが共有FOした。","source_event_ids":["ruru352698.provisional.d2.medium-time-reversal-co","ruru352698.provisional.d2.shared-fo"],"confidence":"reviewed_extraction","alternatives":[]},{"fact_id":"f5","statement":"参加できるよはCOなしを明言した。","source_event_ids":["ruru352698.provisional.d2.participate-no-co"],"confidence":"reviewed_extraction","alternatives":[]},{"fact_id":"f6","statement":"共有は参加できるよを即処刑せずグレランを指示した。","source_event_ids":["ruru352698.provisional.d2.group-vote-order"],"confidence":"reviewed_extraction","alternatives":[]},{"fact_id":"f7","statement":"はめたろうは盤面が大きく動いた後も、盤面・占い・グレーへの判断をほぼ提示していない。","source_event_ids":["ruru352698.provisional.d2.hametaro-low-information"],"confidence":"reviewed_extraction","alternatives":[]}],"private_facts":[],"possible_worlds":[{"world_id":"w-zubunure-true","summary":"ずぶぬれお化け真、参加できるよ狼。","required_assumptions":["ずぶぬれお化けの黒結果が真"],"role_assignments":{"ずぶぬれお化け":"seer","参加できるよ":"werewolf"},"notes":"参加できるよは飼い狼候補になる。"},{"world_id":"w-pyuri-true","summary":"ぴゅりくれあ真、参加できるよ非狼。","required_assumptions":["ぴゅりくれあの白結果が真"],"role_assignments":{"ぴゅりくれあ":"seer","参加できるよ":"not_werewolf"},"notes":"参加処刑は真の白を失う。"},{"world_id":"w-variant-true","summary":"バリアントナイフ真で、パンダを作った二候補はともに偽。","required_assumptions":["バリアントナイフが真占い"],"role_assignments":{"バリアントナイフ":"seer"},"notes":"パンダ処刑は偽占い同士の結果衝突へ村を巻き込む可能性がある。"},{"world_id":"w-fox-mixed","summary":"占い候補に狐が混じる。","required_assumptions":["3-1に狐騙りが存在"],"role_assignments":{},"notes":"論理上残すが、この日の投票・護衛方針を通常内訳から変更する具体的異常はない。"}],"impossible_worlds":[{"world_id":"w-both-panda-results-true","summary":"参加できるよへの白黒がともに真結果。","contradiction":"同一参加者は狼と非狼を同時に満たせない。","unsat_core":["ruru352698.provisional.d2.zubunure-black-participate","ruru352698.provisional.d2.pyuri-white-participate"]}],"conditional_deductions":[{"if_assumptions":["参加できるよ狼"],"then_statement":"狼はぴゅりくれあの参加できるよ○が偽だと知り、占い候補を村より強く絞れる。","supporting_event_ids":["ruru352698.provisional.d2.zubunure-black-participate","ruru352698.provisional.d2.pyuri-white-participate"]},{"if_assumptions":["参加できるよ非狼"],"then_statement":"狼はずぶぬれお化けの参加できるよ●が偽だと知り、占い候補を村より強く絞れる。","supporting_event_ids":["ruru352698.provisional.d2.zubunure-black-participate","ruru352698.provisional.d2.pyuri-white-participate"]},{"if_assumptions":["参加できるよを即処刑","霊結果を重要視"],"then_statement":"狩人の選択肢に霊能が強く入り、真占い護衛の成功率を下げ得る。","supporting_event_ids":["ruru352698.provisional.d2.medium-time-reversal-co","ruru352698.provisional.d2.participate-no-co"]}],"expert_assessment":{"main_world_ids":["w-zubunure-true"],"alternative_world_ids":["w-pyuri-true","w-variant-true","w-fox-mixed"],"confidence":"medium","disagreement_expected":true,"reason":"ずぶぬれ真をやや上に置くが、7吊り5人外で黒を急いで処刑する必要はなく、主要な真占い世界すべてでグレー処理と占い護衛集中に価値がある。"},"weighting_factors":[{"factor_id":"wf1","description":"狼は参加できるよの実際の色を知るため、少なくとも一人の偽占い候補を初日から除外できる可能性が高い。","direction":"supports","strength":"strong","target_world_ids":["w-zubunure-true","w-pyuri-true","w-variant-true"],"source_event_ids":["ruru352698.provisional.d2.zubunure-black-participate","ruru352698.provisional.d2.pyuri-white-participate"],"causal_group_id":"cg-panda-wolf-information","derived_from_factor_ids":[],"explanation":"初手黒・パンダ盤面は即占い襲撃の危険を通常の3-1より高める。"},{"factor_id":"wf2","description":"参加できるよを保留すると、霊能結果を見るはの護衛圧を弱めて占い候補へ護衛を寄せやすい。","direction":"supports","strength":"strong","target_world_ids":["w-zubunure-true","w-pyuri-true","w-variant-true"],"source_event_ids":["ruru352698.provisional.d2.medium-time-reversal-co","ruru352698.provisional.d2.group-vote-order"],"causal_group_id":"cg-guard-allocation","derived_from_factor_ids":[],"explanation":"即時のライン情報を失う代わりに、真占いの生存と追加結果を買う。"},{"factor_id":"wf3","description":"はめたろうは公開情報が増えても判断量が増えず、終盤の判定可能性と占い価値が低い。","direction":"supports","strength":"medium","target_world_ids":["w-zubunure-true","w-pyuri-true","w-variant-true"],"source_event_ids":["ruru352698.provisional.d2.hametaro-low-information"],"causal_group_id":"cg-grey-execution-value","derived_from_factor_ids":[],"explanation":"役職識別ではなく今日の処刑価値として評価する。"},{"factor_id":"wf4","description":"占い3COで狐混じりは可能だが、具体的異常がなく通常の投票・護衛を変える利益がない。","direction":"opposes","strength":"medium","target_world_ids":["w-fox-mixed"],"source_event_ids":["ruru352698.provisional.d2.variant-white-17aman","ruru352698.provisional.d2.medium-time-reversal-co"],"causal_group_id":"cg-exotic-composition-stage","derived_from_factor_ids":[],"explanation":"真相が狐混じりでも、序盤からその世界へ大きな重みを置く必要はない。"}],"recommended_action":{"action_type":"vote","target_id":"はめたろう","reason":"参加できるよを保留して占い候補への護衛配分を厚くし、判断量が少なく終盤に残しにくい完全グレーを処理する。","alternatives":[{"action_type":"execute","target_id":"参加できるよ","reason":"霊結果による高い情報価値と狩人保護はあるが、霊護衛を誘発し真占い即死の損失が大きい。"},{"action_type":"vote","target_id":"みすりる","reason":"一般論中心で具体的なグレー判断が少なく、次点の低情報処理候補。"}]},"common_mistakes":["パンダだから霊結果を見ればよいと、占い死亡時の損失を落とす。","COなしを非狼要素として扱う。","狐混じりが論理上残るだけで通常のグレランや護衛方針を曲げる。","発言数だけを数え、公開情報に対して判断が増えたかを見ない。"],"counterexamples":[{"description":"占い4COで狐混じりが通常内訳上強くなる場合。","changed_condition":"占い候補が4人になる。","expected_effect":"狐混じり・狼2騙りを占い指示や役職処理へ早期に反映する価値が上がる。","related_factor_ids":["wf4"]},{"description":"参加できるよが狩人COし対抗関係が発生した場合。","changed_condition":"COなしではなく狩人COがある。","expected_effect":"グレー処理、護衛指示、対抗露出の価値を再計算する。","related_factor_ids":["wf2"]}],"ai_correction":{"initial_assessment":"パンダ吊りとグレランはほぼ同程度で、主な差は即時の占い真偽情報である。","expert_correction":"中心差は護衛配分である。狼が占い真偽を大きく絞っている可能性が高い盤面で、パンダ吊りは霊能護衛を重要化し真占い即噛みを通しやすくする。","error_categories":["faction_objective","weight_too_weak"],"why_the_ai_failed":"処刑後に得る情報だけを評価し、夜の襲撃・護衛ゲームと真占い死亡の非対称損失を十分に組み込まなかった。","generalized_prevention_rule":"初手黒・パンダ処刑を比較するときは、翌日の霊結果だけでなく狼の真偽情報、狩人の候補数、真占い死亡時の損失を独立に評価する。","rule_counterexamples":["真占いがすでに確定しているなら霊護衛競合の問題は小さくなる。","占い候補が全員死亡済みなら護衛配分は比較要素にならない。"]},"review":{"status":"expert_reviewed","reviewer":"human-expert-joint-review","reviewed_at":"2026-08-06T20:59:00+09:00","training_ready":false,"blocking_issues":["Canonical event IDs are not parsed.","Public and full logs are not automatically aligned.","Independent adjudication is pending."]},"provenance":{"parser_version":"unparsed-provisional-source-ids","annotation_model":"GPT-5.6 Thinking with human expert correction","prompt_version":"joint-log-review-v1","source_event_ids":["ruru352698.provisional.d2.zubunure-black-participate","ruru352698.provisional.d2.pyuri-white-participate","ruru352698.provisional.d2.variant-white-17aman","ruru352698.provisional.d2.medium-time-reversal-co","ruru352698.provisional.d2.shared-fo","ruru352698.provisional.d2.participate-no-co","ruru352698.provisional.d2.group-vote-order","ruru352698.provisional.d2.hametaro-low-information"]}}
